{
  "schema_version": "non_rectangular_multi_room_scene_v1",
  "layout_id": "fixture_simple_multi_room",
  "coordinate_frame": {
    "origin": "shared_scene_global",
    "axes": "x_width_y_depth_z_up",
    "handedness": "right_handed",
    "unit": "meter",
    "rotation_unit": "degree"
  },
  "room_order": ["room_000", "room_001"],
  "rooms": [
    {
      "room_id": "room_000",
      "program_id": "kitchen_01",
      "room_type": "kitchen",
      "objects": [
        {
          "id": "fixture.object_000",
          "slot_id": "counter",
          "category": "counter",
          "description": "A kitchen counter.",
          "size": [1.2, 0.6, 0.9],
          "center": [1.0, 1.0, 0.45],
          "rotation": [0.0, 0.0, 0.0],
          "geometry_provenance": "bbox_proxy"
        },
        {
          "id": "fixture.object_001",
          "slot_id": "stool",
          "category": "stool",
          "description": "A counter stool.",
          "size": [0.5, 0.5, 0.9],
          "center": [2.0, 1.0, 0.45],
          "rotation": [0.0, 0.0, 0.0],
          "geometry_provenance": "bbox_proxy"
        }
      ]
    },
    {
      "room_id": "room_001",
      "program_id": "living_room_01",
      "room_type": "living_room",
      "objects": [
        {
          "id": "fixture.object_002",
          "slot_id": "sofa",
          "category": "sofa",
          "description": "A compact sofa.",
          "size": [1.4, 0.7, 0.8],
          "center": [5.7, 1.6, 0.4],
          "rotation": [0.0, 0.0, 90.0],
          "geometry_provenance": "bbox_proxy"
        },
        {
          "id": "fixture.object_003",
          "slot_id": "coffee_table",
          "category": "coffee_table",
          "description": "A low coffee table.",
          "size": [0.8, 0.5, 0.4],
          "center": [4.2, 0.6, 0.2],
          "rotation": [0.0, 0.0, 0.0],
          "geometry_provenance": "bbox_proxy"
        }
      ]
    }
  ],
  "provenance": {"source": "contract_fixture"}
}
